[
  {
    "id": "f110d69d39a54e93bbf8c73e7ebb0b80",
    "name": "Login Flow - Chrome Latest",
    "status": "passed",
    "passed": true,
    "owner": "john.doe",
    "build": "release-2024-06",
    "browser": "chrome",
    "browser_version": "125.0.6422.112",
    "browser_short_version": "125",
    "os": "Windows 11",
    "automation_backend": "webdriver",
    "creation_time": 1717200000,
    "start_time": 1717200005,
    "end_time": 1717200125,
    "modification_time": 1717200126,
    "deletion_time": null,
    "tags": ["regression", "login"],
    "public": "private",
    "video_url": "https://assets.saucelabs.com/jobs/f110d69d39a54e93bbf8c73e7ebb0b80/video.mp4",
    "log_url": "https://assets.saucelabs.com/jobs/f110d69d39a54e93bbf8c73e7ebb0b80/selenium-server.log",
    "commands_not_successful": 0,
    "consolidated_status": "passed",
    "assigned_tunnel_id": null,
    "proxied": false,
    "proxy_host": null,
    "record_screenshots": true,
    "record_video": true,
    "selenium_version": "4.18.1",
    "manual": false,
    "collects_automator_log": false,
    "video_secret": null,
    "command_counts": {"All": 42, "Error": 0},
    "base_config": {
      "browserName": "chrome",
      "platformName": "Windows 11",
      "sauce:options": {
        "build": "release-2024-06",
        "name": "Login Flow - Chrome Latest"
      }
    },
    "custom-data": null
  },
  {
    "id": "a3c72e10b4f14d9c95f1e20a37cd8bb3",
    "name": "Checkout Flow - Firefox ESR",
    "status": "failed",
    "passed": false,
    "owner": "john.doe",
    "build": "release-2024-06",
    "browser": "firefox",
    "browser_version": "115.0",
    "browser_short_version": "115",
    "os": "macOS 13",
    "automation_backend": "webdriver",
    "creation_time": 1717200200,
    "start_time": 1717200210,
    "end_time": 1717200340,
    "modification_time": 1717200341,
    "deletion_time": null,
    "tags": ["regression", "checkout"],
    "public": "private",
    "video_url": "https://assets.saucelabs.com/jobs/a3c72e10b4f14d9c95f1e20a37cd8bb3/video.mp4",
    "log_url": "https://assets.saucelabs.com/jobs/a3c72e10b4f14d9c95f1e20a37cd8bb3/selenium-server.log",
    "commands_not_successful": 3,
    "consolidated_status": "failed",
    "assigned_tunnel_id": null,
    "proxied": false,
    "proxy_host": null,
    "record_screenshots": true,
    "record_video": true,
    "selenium_version": "4.18.1",
    "manual": false,
    "collects_automator_log": false,
    "video_secret": null,
    "command_counts": {"All": 55, "Error": 3},
    "base_config": {
      "browserName": "firefox",
      "platformName": "macOS 13",
      "sauce:options": {
        "build": "release-2024-06",
        "name": "Checkout Flow - Firefox ESR"
      }
    },
    "custom-data": {"sprint": "sprint-42", "team": "checkout"}
  }
]
